line_number,text,Source
193,ఇహ హి మధుర గీతం నృత్యమేతద్రసో-యం,srungara_satakam
194,స్ఫురతి పరిమళో-సౌ స్పర్శ ఏష స్తనానామ్ ।,srungara_satakam
195,ఇతి హత పరమార్థైరింద్రియైర్భ్రామ్యమాణః,srungara_satakam
196,స్వ హిత కరణ ధూర్తైః పంచభిర్వంచితో-స్మి ॥ 55,srungara_satakam
197,న గమ్యో మంత్రాణాం న చ భవతి భైషజ్య విషయో,srungara_satakam
198,న చాపి ప్రధ్వంసం వ్రజతి వివిధైః శాంతిక శతైః ।,srungara_satakam
199,భ్రమావేశాదంగే కమపి విదధద్భంగమసకృత్,srungara_satakam
200,స్మరాపస్మారో-యం భ్రమయతి దృశం ఘూర్ణయతి చ ॥ 56,srungara_satakam
201,జాత్యంధాయ చ దుర్ముఖాయ చ జరాజీర్ణాఖిలాంగాయ చ,srungara_satakam
202,గ్రామీణాయ చ దుష్కులాయ చ గళత్కుష్ఠాభిభూతాయ చ ।,srungara_satakam
203,యచ్ఛంతీషు మనోహరం నిజ వపుర్లక్ష్మీ లవ శ్రద్ధయా,srungara_satakam
204,పణ్య స్త్రీషు వివేక కల్ప లతికాశ స్త్రీషు రజ్యేత కః ॥ 57,srungara_satakam
205,వేశ్యాసౌ మదన జ్వాలా రూపే-ంధన వివర్ధితా ।,srungara_satakam
206,కామిభిర్యత్ర హూయంతే యౌవనాని ధనాని చ ॥ 58,srungara_satakam
207,కశ్చుంబతి కుల పురుషో వేశ్యాధర పల్లవం మనోజ్ఞమపి ।,srungara_satakam
208,చారభట చోర చేటక నట విట నిష్ఠీవన శరావమ్॥ 59,srungara_satakam
209,మధు తిష్ఠతి వాచి యోషితాం హృది హాలాహలమేవ కేవలమ్ ।,srungara_satakam
210,అతఏవ నిపీయతే-ధరో హృదయం ముష్టిభిరేవ తాడ్యతే ॥ 60,srungara_satakam
211,ధన్యాస్త ఏవ ధవళాయత లోచనానాం,srungara_satakam
212,తారుణ్య దర్ప ఘన పీన పయోధరాణామ్ ।,srungara_satakam
213,క్షామోదరోపరి లసత్త్రివళీ లతానాం,srungara_satakam
214,దృష్వ్టా--కృతిం వికృతిమేతి మనో న యేషామ్॥ 61,srungara_satakam
215,బాలే! లీలా ముకుళితమమీ మంథరా దృష్టి పాతాః,srungara_satakam
216,కిం క్షిప్యంతే విరమ విరమ వ్యర్థ ఏష శ్రమస్తే ।,srungara_satakam
217,సంప్రత్యన్యే వయ ముపరతం బాల్యమాస్థా వనాంతే,srungara_satakam
218,క్షీణో మోహ స్తృణమివ జగజ్జాలమాలోకయామః ॥ 62,srungara_satakam
219,ఇయం బాలా మాం ప్రత్యనవరతమిందీవర దళ,srungara_satakam
220,ప్రభా చోరం చక్షుః క్షిపతి కిమభిప్రేతమనయా ।,srungara_satakam
221,గతో మోహో-స్మాకం స్మర కుసుమ బాణ వ్యతికర,srungara_satakam
222,జ్వర జ్వాలా శాంతా తదపి న వరాకీ విరమతి ॥ 63,srungara_satakam
223,రే కందర్ప కరం కదర్థయసి కిం కోదండ టంకారితైః,srungara_satakam
224,రే రే కోకిల కోమలైః కలరవైః కిం వా వృథా జల్పసి ।,srungara_satakam
225,ముగ్ధే స్నిగ్ధ విదగ్ధ ముగ్ధ మధురైర్లోలైః కటాక్షైరలం,srungara_satakam
226,చేతశ్చుంబిత చంద్రచూడచరణ ధ్యానామృతం వర్తతే ॥ 64,srungara_satakam
227,విరహే-పి సంగమః ఖలు పరస్పరం సంగతం మనో యేషామ్ ।,srungara_satakam
228,హృదయమపి విఘటితం చేత్ సంగో విరహం విశేషయతి ॥ 65,srungara_satakam
229,కిం గతేన యది సా న జీవతి ప్రాణితి ప్రియతమా తథా-పి కిమ్ ।,srungara_satakam
230,ఇత్యుదీక్ష్య నవమేఘమాలికాం న ప్రయాతి పథికః స్వ మందిరమ్॥ 66,srungara_satakam
231,విరమత బుధా యోషిత్సంగౌత్సుఖాత్క్షణ భంగురాత్,srungara_satakam
232,కురుత కరుణా మైత్రీ ప్రజ్ఞా వధూజనసంగమమ్ ।,srungara_satakam
233,న ఖలు నరకే హారాక్రాంతం ఘనస్తనమండలం,srungara_satakam
234,శరణమథవా శ్రోణీబింబం రణన్మణి మేఖలమ్॥ 67,srungara_satakam
235,యదా యోగాభ్యాస వ్యసన కృశయోరాత్మ మనసో,srungara_satakam
236,రవిచ్ఛిన్నా మైత్రీ స్ఫురతి కృతిన స్తస్య కిము తైః ।,srungara_satakam
237,ప్రియాణా మాలాపై రధర మధుభిర్వక్త్ర విధుభిః,srungara_satakam
238,సనిశ్వాసామోదైః సకుచ కలశాశ్లేష సురతైః ॥ 68,srungara_satakam
239,యదాసీదజ్ఞానం స్మర తిమిర సంచార జనితం,srungara_satakam
240,తదా దృష్టం నారీ మయమిదమశేషం జగదితి ।,srungara_satakam
241,ఇదానీ మస్మాకం పటుతర వివేకాంజన జుషాం,srungara_satakam
242,సమీభూతా దృష్టిస్త్రిభువనమపి బ్రహ్మ మనుతే ॥ 69,srungara_satakam
243,తావదేవ కృతినామపి స్ఫుర త్యేష నిర్మల వివేక దీపకః ।,srungara_satakam
244,యావదేవ న కురంగ చక్షుషాం తాడ్యతే చటుల లోచనాంచలైః ॥ 70,srungara_satakam
245,వచసి భవతి సంగ త్యాగముద్దిశ్య వార్తా,srungara_satakam
246,శ్రుతి ముఖర ముఖానాం కేవలం పండితానామ్ ।,srungara_satakam
247,జఘనమరుణ రత్న గ్రంథికాంచీకలాపం,srungara_satakam
248,కువలయ నయనానాం కో విహాతుం సమర్థః ॥ 71,srungara_satakam
249,స్వ పర ప్రతారకో-సౌ నిందతి యో-ళీక పండితో యువతీః ।,srungara_satakam
250,యస్మాత్తపసో-పి ఫలం స్వర్గః స్వర్గే-పి చాప్సరసః ॥ 72,srungara_satakam
251,మత్తేభ కుంభ దళనే భువి సంతి ధీరాః,srungara_satakam
252,కేచిత్ప్రచండ మృగరాజ వధే-పి దక్షాః ।,srungara_satakam
253,కింతు బ్రవీమి బలినాం పురతః ప్రసహ్య,srungara_satakam
254,కందర్ప దర్ప దళనే విరళా మనుష్యాః ॥ 73,srungara_satakam
255,సన్మార్గే తావదాస్తే ప్రభవతి చ నరస్తావ దే వేంద్రియాణాం,srungara_satakam
256,లజ్జాం తావద్విధత్తే వినయమపి సమాలంబతే తావదేవ ।,srungara_satakam
257,భ్రూ చాపాకృష్ట ముక్తాః శ్రవణ పథ గతా నీల పక్ష్మాణ ఏతే,srungara_satakam
258,యావల్లీలావతీనాం హృది న ధృతిముషో దృష్టి బాణాః పతంతి ॥ 74,srungara_satakam
259,ఉన్మత్త ప్రేమ సంరంభాదారభంతే యదంగనాః ।,srungara_satakam
260,తత్ర ప్రత్యూహమాధాతుం బ్రహ్మాపి ఖలు కాతరః ॥ 75,srungara_satakam
261,తావన్మహత్వ్తం పాండిత్యం కులీనత్వం వివేకితా ।,srungara_satakam
262,యావజ్వ్జలతి నాంగేషు హతః పంచేషు పావకః ॥ 76,srungara_satakam
263,శాస్త్రజ్ఞో-పి ప్రగుణితనయో-ప్యాత్త బోధో-పి బాఢం,srungara_satakam
264,సంసారే-స్మిన్భవతి విరళో భాజనం సద్గతీనామ్ ।,srungara_satakam
265,యేనైతస్మి న్నిరయ నగర ద్వారముద్ఘాటయంతీ,srungara_satakam
266,వామాక్షీణాం భవతి కుటిలా భ్రూలతా కుంచికేవ ॥ 77,srungara_satakam
267,కృశః కాణః ఖంజః శ్రవణ రహితః పుచ్ఛ వికలో,srungara_satakam
268,వ్రణీ పూయ క్లిన్నః కృమి కులశతై రావృతతనుః ।,srungara_satakam
269,క్షుధా క్షామో జీర్ణః పిఠరక కపాలార్పిత గళః,srungara_satakam
270,శునీమన్వేతి శ్వా హతమపి చ హంత్యేవ మదనః ॥ 78,srungara_satakam
271,స్త్రీ ముద్రాం ఝషకేతనస్య పరమాం సర్వార్థ సంపత్కరీం,srungara_satakam
272,యే మూఢాః ప్రవిహాయ యాంతి కుధియో మిథ్యా ఫలాన్వేషిణః ।,srungara_satakam
273,తే తేనైవ నిహత్య నిర్దయతరం నగ్నీకృతా ముండితాః,srungara_satakam
274,కేచిత్పంచ శిఖీ కృతాశ్చ జటిలాః కాపాలికాశ్చాపరే ॥ 79,srungara_satakam
275,విశ్వామిత్ర పరాశర ప్రభృతయో వాతాంబూ పర్ణాశనా,srungara_satakam
276,స్తే-పి స్త్రీ ముఖపంకజం సులలితం దృష్వ్టైవ మోహం గతాః ।,srungara_satakam
277,శాల్యన్నం స ఘృతం పయోదధియుతం యే భుంజతే మానవా,srungara_satakam
278,స్తేషామింద్రియ నిగ్రహో యది భవేద్వింధ్యః ప్లవేత్సాగరే ॥ 80,srungara_satakam
279,పరిమళ భృతో వాతాః శాఖా నవాంకుర కోటయో,srungara_satakam
280,మధుర విధురోత్కంఠా భాజః ప్రియా పిక పక్షిణామ్ ।,srungara_satakam
281,విరళ విరళ స్వేదోద్గారా వధూ వదనేందవః,srungara_satakam
282,ప్రసరతి మధౌ ధాత్య్రాం జాతో న కస్య గుణోదయః ॥ 81,srungara_satakam
283,మధు రయం మధురైరపి కోకిలా,srungara_satakam
284,కలరవై ర్మలయస్య చ వాయుభిః ।,srungara_satakam
285,విరహిణః ప్రహిణస్తి శరీరిణో,srungara_satakam
286,విపది హంత సుధా-పి విషాయతే ॥ 82,srungara_satakam
287,ఆవాసః కిల కించితస్య దయితాః పార్శ్వే విలాసాలసాః,srungara_satakam
288,కర్ణే కోకిల కామినీ కల రవః స్మేరో లతా మంటపః ।,srungara_satakam
289,గోష్ఠీ సత్కవిభిః సమం కతిపయైః సేవ్యాః సితాంశోః కరాః,srungara_satakam
290,కేషాంచిత్సుఖయంత్యవేహి హృదయం చైత్రే విచిత్రాః క్షపాః ॥ 83,srungara_satakam
291,పాంథ స్త్రీ విరహానలాహుతి కలామాతన్వతీ మంజరీ,srungara_satakam
292,మాకందేషు పికాంగనాభిరధునా సోత్కంఠమాలోక్యతే ।,srungara_satakam
293,అప్యేతే నవ పాటలా పరిమళ ప్రాగ్భార పాటచ్చరా,srungara_satakam
294,వాంతి క్లాంతి వితాన తానవ కృతః శ్రీఖండ శైలానిలాః ॥ 84,srungara_satakam
295,ప్రథితః ప్రణయవతీనాం తావత్పదమాతనోతు హృది మానః ।,srungara_satakam
296,భవతి న యావచ్చందన తరు సురభిర్మలయ పవమానః ॥ 85,srungara_satakam
297,సహకార కుసుమ కేసర నికర భరామోద మూర్ఛిత దిగంతే ।,srungara_satakam
298,మధుర మధు విధుర మధుపే మధౌ భవేత్కస్య నోత్కంఠా ॥ 86,srungara_satakam
299,అచ్ఛాచ్ఛ చందన రసార్ద్రతరా మృగాక్ష్యో,srungara_satakam
300,ధారా గృహాణి కుసుమాని చ కౌముదీ చ ।,srungara_satakam
301,మందో మరుత్సుమనసః శుచి హర్మ్య పృష్ఠం,srungara_satakam
302,గ్రీష్మే మదం చ మదనం చ వివర్ధయంతి ॥ 87,srungara_satakam
303,స్రజో హృద్యామోదా వ్యజన పవనశ్చంద్ర కిరణాః,srungara_satakam
304,పరాగః కాసారో మలయజ రజః సీధు విశదమ్ ।,srungara_satakam
305,శుచిః సౌధోత్సంగః ప్రతను వసనం పంకజ దృశో,srungara_satakam
306,నిదాఫూర్తా వేతద్విలసతి లభంతే సుకృతినః ॥ 88,srungara_satakam
307,సుధా శుభ్రం ధామ స్ఫురదమల రశ్మిః శశధరః,srungara_satakam
308,ప్రియా వక్త్రాంభోజం మలయజ రసశ్చాతిసురభిః ।,srungara_satakam
309,స్రజో హృద్యామోదాస్తదిదమఖిలం రాగిణి జనే,srungara_satakam
310,కరోత్యంతః క్షోభం న తు విషయ సంసర్గ విముఖే ॥ 89,srungara_satakam
311,తరుణీ వైషా దీపితకామా వికసితజాతీ పుష్ప సుగంధిః ।,srungara_satakam
312,ఉన్నత పీన పయోధరభారా ప్రావృట్తనుతే కస్య న హర్షమ్॥ 90,srungara_satakam
313,వియదుపచిత మేఘం భూమయః కందళిన్యో,srungara_satakam
314,నవ కుటజ కదంబామోదినో గంధవాహాః ।,srungara_satakam
315,శిఖికుల కల కేకారావ రమ్యావనాంతాః,srungara_satakam
316,సుఖిన మసుఖినం వా సర్వముత్కంఠయంతి ॥ 91,srungara_satakam
317,ఉపరి ఘనం ఘన పటలం తిర్యగ్గిరయో-పి నర్తిత మయూరాః ।,srungara_satakam
318,క్షితిరపి కందళ ధవళా దృష్టిం పథికః క్వ పాతయతి ॥ 92,srungara_satakam
319,ఇతో విద్యుద్వల్లీ విలసిత మితః కేతకి తరోః,srungara_satakam
320,స్ఫురన్గంధః ప్రోద్యజ్జలద నినద స్ఫూర్జితమితః ।,srungara_satakam
321,ఇతః కేకి క్రీడా కలకలరవః పక్ష్మల దృశాం,srungara_satakam
322,కథం యాస్యంత్యేతే విరహ దివసాః సంభృత రసాః ॥ 93,srungara_satakam
323,అసూచీ సంచారే తమసి నభసి ప్రౌఢ జలద,srungara_satakam
324,ధ్వని ప్రాజ్ఞమ్మన్యే పతతి పృషతానాం చ నిచయే ।,srungara_satakam
325,ఇదం సౌదామన్యాః కనక కమనీయం విలసితం,srungara_satakam
326,ముదం చ మ్లానిం చ ప్రథయతి పథి స్వైర సుదృశామ్॥ 94,srungara_satakam
327,ఆసారేణ న హర్మ్యతః ప్రియతమై ర్యాతుం బహిః శక్యతే,srungara_satakam
328,శీతోత్కంప నిమిత్తమాయత దృశా గాఢం సమాలింగ్యతే ।,srungara_satakam
329,జాతాః శీకర శీతలాశ్చ మరుతోరత్యంత ఖేద చ్ఛిదో,srungara_satakam
330,ధన్యానాం బత దుర్దినం సుదినతాం యాతి ప్రియా సంగమే ॥ 95,srungara_satakam
331,అర్ధం సుప్వ్తా నిశాయాః సరభస సురతాయాస సన్న శ్లథాంగః,srungara_satakam
332,ప్రోద్భూతాసహ్య తృష్ణో మధు మద నిరతో హర్మ్య పృష్ఠే వివిక్తే ।,srungara_satakam
333,సంభోగ క్లాంత కాంతా శిథిల భుజ లతా వర్జితం కర్కరీతో,srungara_satakam
334,జ్యోత్స్నాభిన్నాచ్ఛ ధారం పిబతి న సలిలం శారదం మంద పుణ్యః ॥ 96,srungara_satakam
335,హేమంతే దధి దుగ్ధ సర్పిరశనా మాంజిష్ఠ వాసో భృతః,srungara_satakam
336,కాశ్మీర ద్రవ సాంద్ర దిగ్ధ వపుషః ఖిన్నా విచిత్రై రతైః ।,srungara_satakam
337,వృత్తోరు స్తన కామినీజన కృతాశ్లేషా గృహాభ్యంతరే,srungara_satakam
338,తాంబూలీ దళ పూగ పూరిత ముఖా ధన్యాః సుఖం శేరతే ॥ 97,srungara_satakam
339,ప్రోద్యత్ప్రౌఢ ప్రియంగు ద్యుతి భృతి వికసత్కుంద మాద్యద్వ్దిరేఫే,srungara_satakam
340,కాలే ప్రాలేయ వాత ప్రచల విలసితోదార మందార ధామ్ని ।,srungara_satakam
341,యేషాం నో కంఠ లగ్నా క్షణమపి తుహిన క్షోద దక్షా మృగాక్షీ,srungara_satakam
342,తేషామాయామ యామా యమసదనసమా యామినీ యాతి యూనామ్॥ 98,srungara_satakam
343,చుంబంతో గండ భిత్తీ రలకవతి ముఖే సీత్కృతా న్యాదధానా,srungara_satakam
344,వక్షః సూత్కంచుకేషు స్తన భర పులకోద్భేదమాపాదయంతః ।,srungara_satakam
345,ఊరూ నాకంపయంతః పృథు జఘన తటాత్స్రంసయంతోం-శుకాని,srungara_satakam
346,వ్యక్తం కాంతా జనానాం విట చరిత భృతః శైశిరా వాంతి వాతాః ॥ 99,srungara_satakam
347,కేశానాకులయన్ దృశో ముకులయన్ వాసో బలాదాక్షిప,srungara_satakam
348,న్నాతన్వన్పులకోద్గమం ప్రకటయన్నంగేషు కంపం శనైః ।,srungara_satakam
349,వారం వారముదార సీత్కృత కృతో దంత చ్ఛదాన్ పీడయన్,srungara_satakam
350,ప్రాయః శైశిర ఏష సంప్రతి మరుత్కాంతాసు కాంతాయతే ॥ 100,srungara_satakam
1,చూడోత్తంసిత చారు చంద్రకలికా చంచచ్ఛిఖా భాస్వరో,vairagya_satakam
2,లీలా దగ్ధ విలోల కామ శలభః శ్రేయో దశాగ్రే స్ఫురన్‌ ।,vairagya_satakam
3,అంతః స్ఫూర్జదపార మోహ తిమిర ప్రాగ్భారముచ్చాటయన్‌,vairagya_satakam
4,శ్చేతః సద్మని యోగినాం విజయతే జ్ఞాన ప్రదీపో హరః ॥ 1,vairagya_satakam
5,భ్రాంతం దేశమనేక దుర్గ విషమం ప్రాప్తం న కించిత్ఫలం,vairagya_satakam
6,త్యక్వ్తా జాతి కులాభిమానముచితం సేవా కృతా నిష్ఫలా ।,vairagya_satakam
7,భుక్తం మాన వివర్జితం పర గృహేష్వాశంకయా కాకవత్‌,vairagya_satakam
8,తృష్ణే జృంభసి పాప కర్మ పిశునే నాద్యాపి సంతుష్యసి ॥ 2,vairagya_satakam
9,ఉత్ఖాతం నిధి శంకయా క్షితి తలం ధ్మాతా గిరేర్ధాతవో,vairagya_satakam
10,నిస్తీర్ణః సరితాం పతిర్నృపతయో యత్నేన సంతోషితాః ।,vairagya_satakam
11,మంత్రారాధన తత్పరేణ మనసా నీతాః శ్మశానే నిశాః,vairagya_satakam
12,ప్రాప్తః కాణ వరాటకో-పి న మయా తృష్ణే! సకామా భవ ॥ 3,vairagya_satakam
13,ఖలాలాపాః సోఢాః కథమపి తదారాధన పరై,vairagya_satakam
14,ర్నిగృహ్యాంతర్బాష్పం హసితమపి శూన్యేన మనసా ।,vairagya_satakam
15,కృతో విత్త స్తంభప్రతిహత ధియామంజలిరపి,vairagya_satakam
16,త్వమాశే! మోఫూశే! కి మపర మతో నర్తయసి మామ్‌ ॥ 4,vairagya_satakam
17,అమీషాం ప్రాణానాం తులిత బిసినీ పత్ర పయసాం,vairagya_satakam
18,కృతే కిం నాస్మాభిర్విగళిత వివేకైర్వ్యవసితమ్‌ ।,vairagya_satakam
19,యదాఢ్యానామగ్రే ద్రవిణ మద నిఃసంజ్ఞ మనసాం,vairagya_satakam
20,కృతం వీతవ్రీడై ర్నిజగుణ కథా పాతకమపి ॥ 5,vairagya_satakam
21,క్షాంతం న క్షమయా గృహోచిత సుఖం త్యక్తం న సంతోషతః,vairagya_satakam
22,సోఢో దుఃసహ శీత తాప పవన క్లేశో న తప్తం తపః ।,vairagya_satakam
23,ధ్యాతం విత్తమహర్నిశం నియమితప్రాణైర్న శంభోః పదం,vairagya_satakam
24,తత్తత్కర్మ కృతం యదేవ మునిభిస్తైస్తైః ఫలైర్వంచితాః ॥ 6,vairagya_satakam
25,భోగా న భుక్తా వయమేవ భుక్తా స్తపో న తప్తం వయమేవ తప్తాః ।,vairagya_satakam
26,కాలో న యాతో వయమేవ యాతా స్తృష్ణా న జీర్ణా వయమేవ జీర్ణాః ॥ 7,vairagya_satakam
27,వలిభిర్ముఖమాక్రాంతం పలితేనాంకితం శిరః ।,vairagya_satakam
28,గాత్రాణి శిథిలాయంతే తృష్ణైకా తరుణాయతే ॥ 8,vairagya_satakam
29,నివృత్తా భోగేచ్ఛా పురుష బహు మానో-పి గళితః,vairagya_satakam
